{
  "task_id": "LANGUAGE-LEARNING-APP-MVP-ARCHITECTURE-PLANNING-002",
  "verdict": "ACCEPTED",
  "feature_completed": true,
  "documentation_only": true,
  "product_scope_defined": true,
  "personas_defined": true,
  "user_stories_defined": true,
  "user_story_count": 61,
  "user_journeys_defined": true,
  "functional_requirements_defined": true,
  "non_functional_requirements_defined": true,
  "technology_stack_compared": true,
  "technology_stack_selected": true,
  "architecture_defined": true,
  "api_contracts_defined": true,
  "data_model_defined": true,
  "state_machines_defined": true,
  "llm_gateway_defined": true,
  "dangerous_action_gates_defined": true,
  "security_threat_model_defined": true,
  "privacy_model_defined": true,
  "observability_defined": true,
  "deployment_topology_defined": true,
  "testing_strategy_defined": true,
  "first_implementation_sprint_defined": true,
  "application_code_changed": false,
  "runtime_code_added": false,
  "llm_calls_executed": false,
  "deployment_executed": false,
  "secrets_added": false,
  "tests": {
    "tests_total": 26,
    "tests_passed": 26,
    "tests_failed": 0,
    "warnings": 3
  },
  "traceability": {
    "requirements_total": 65,
    "requirements_traced": 65,
    "requirements_untraced": 0,
    "broken_links": 0
  },
  "git": {
    "branch": "master",
    "starting_commit": "c331ff5ea54dfc497ef4e3c7097bca9d237953fa",
    "final_commit": "4beb587a2fb5098d724d13c0a46a72d4a986335b",
    "commit_created": true,
    "commit_pushed": true,
    "git_clean": true,
    "head_matches_origin": true
  },
  "unresolved_blockers": [],
  "current_state": "mvp_architecture_planning_complete",
  "next_allowed_action": "first_mvp_vertical_slice_implementation",
  "application_implementation_allowed": false,
  "production_accepted": false
}
